{
  "id": "embed.text",
  "version": "1.0.0",
  "slot": "embed.text",
  "input_schema": {
    "type": "object",
    "additionalProperties": false,
    "required": ["texts"],
    "properties": {
      "texts": { "type": "array", "minItems": 1, "maxItems": 64, "items": { "type": "string", "maxLength": 2000 } }
    }
  },
  "output_schema": {
    "type": "object",
    "additionalProperties": false,
    "required": ["dim", "vectors"],
    "properties": {
      "dim": { "type": "integer", "minimum": 1 },
      "vectors": {
        "type": "array",
        "items": { "type": "array", "items": { "type": "number" } }
      },
      "provider_note": { "type": "string" }
    }
  },
  "providers": [
    {
      "class": "remote_api",
      "source_model": null, "world_model_backend": false, "determinism": "non_deterministic", "allowed_in_rule_layer": false,
      "source_model": null, "world_model_backend": false, "determinism": "non_deterministic", "allowed_in_rule_layer": false,
      "source_model": null, "world_model_backend": false, "determinism": "non_deterministic", "allowed_in_rule_layer": false,
      "impl": "builtin:openai_compatible_embeddings",
      "priority": 90,
      "model": "text-embedding-3-small",
      "determinism_note": "best_effort：远端嵌入服务版本变更会改变向量；回放必须走 cassette_replay。【r3 裁决（PM 变更单）：本通道不可用 —— tokenfab /v1/embeddings 对 text-embedding-3-small 返回 404 model_not_found，该通道无任何嵌入模型；priority 已由 10 摘到 90，默认路由不再选中；见 02_source/07_adr.md ADR-014 与 06 §GAP-E1。】",
      "requires_secrets": ["HERMES_CUSTOM_TOKENFAB_API_KEY"]
    },
    {
      "class": "cassette_replay",
      "source_model": null, "world_model_backend": false, "determinism": "deterministic", "allowed_in_rule_layer": true,
      "source_model": null, "world_model_backend": false, "determinism": "deterministic", "allowed_in_rule_layer": true,
      "source_model": null, "world_model_backend": false, "determinism": "deterministic", "allowed_in_rule_layer": true,
      "impl": "builtin:cassette_replay",
      "priority": 50,
      "determinism_note": "replayable：逐字节等价。"
    },
    {
      "class": "local_model",
      "source_model": null, "world_model_backend": false, "determinism": "non_deterministic", "allowed_in_rule_layer": false,
      "source_model": null, "world_model_backend": false, "determinism": "non_deterministic", "allowed_in_rule_layer": false,
      "source_model": null, "world_model_backend": false, "determinism": "non_deterministic", "allowed_in_rule_layer": false,
      "impl": "builtin:transformers_local",
      "priority": 30,
      "model": "bge-small-zh-v1.5",
      "determinism_note": "best_effort：CPU 推理（本机无 NVIDIA GPU），量化差异会影响末位小数。"
    },
    {
      "class": "deterministic_rule",
      "source_model": null, "world_model_backend": false, "determinism": "deterministic", "allowed_in_rule_layer": true,
      "source_model": null, "world_model_backend": false, "determinism": "deterministic", "allowed_in_rule_layer": true,
      "source_model": null, "world_model_backend": false, "determinism": "deterministic", "allowed_in_rule_layer": true,
      "impl": "module:deephealing_kernel.providers.deterministic_rule:embed_text_rule",
      "priority": 40,
      "determinism_note": "pure：字符 n-gram 哈希袋投影到固定维（默认 128 维），同输入同输出；仅作离线兜底，语义质量不保证。"
    }
  ],
  "cost": {
    "usd_per_1k_in": 0.00002,
    "usd_per_1k_out": 0.0,
    "est_tokens_in": 200,
    "est_tokens_out": 0,
    "currency": "USD"
  },
  "latency_ms_budget": 42400,
  "timeout_ms": 43650,
  "calibration": {
    "sample_count": 24,
    "p50_ms": 7443.408,
    "p90_ms": 42110.951,
    "p95_ms": 43358.907,
    "p99_ms": 54031.089,
    "max_ms": 54031.089,
    "derivation_rule": "声明值 = ceil_to(100, p95) + offset_ms(embed.text=250)；latency_ms_budget = ceil_to(50, p90) + offset_ms",
    "derivation_rule_sha256": "7590eab4b765671860eaa50b68de807606581bfdd439cb3aa6fe2d953edb0feb",
    "candidate_strict_ms": 43650,
    "candidate_loose_ms": 55750,
    "accepted_degradation_range": "0.00-0.30",
    "command": "python3 calibrate.py degrade --formula adopted --runs 10 --out logs/degradation.adopted.json",
    "workdir": "/Users/wooyinq/.hermes/profiles/lanova/dev_team_workspace/REQ-20260921-002-deephealing-architecture-freeze/spikes/s5-latency-calibration",
    "exit": 0,
    "log_path": "/Users/wooyinq/.hermes/profiles/lanova/dev_team_workspace/REQ-20260921-002-deephealing-architecture-freeze/spikes/s5-latency-calibration/logs/latency.distribution.json",
    "degradation_log_path": "/Users/wooyinq/.hermes/profiles/lanova/dev_team_workspace/REQ-20260921-002-deephealing-architecture-freeze/spikes/s5-latency-calibration/logs/degradation.adopted.json",
    "gap_note": "分布取自同一 API 通道的 24 次真实调用（round 3）；本能力的真实调用条件与分布测量**同条件**（同并发/同网络/同冷热）；远端不可用时不得用未标定的数"
  },
  "rule_layer_adoption": {
    "allowed": true,
    "provider_classes_allowed": ["deterministic_rule", "cassette_replay"],
    "consistency_check": { "required": true, "runs": 3 }
  },
  "calibration": {
    "sample_count": 24,
    "p50_ms": 7443.408,
    "p90_ms": 42110.951,
    "p95_ms": 43358.907,
    "p99_ms": 54031.089,
    "max_ms": 54031.089,
    "derivation_rule": "声明值 = ceil_to(100, p95) + offset_ms(embed.text=250)；latency_ms_budget = ceil_to(50, p90) + offset_ms",
    "derivation_rule_sha256": "7590eab4b765671860eaa50b68de807606581bfdd439cb3aa6fe2d953edb0feb",
    "candidate_strict_ms": 43650,
    "candidate_loose_ms": 55750,
    "accepted_degradation_range": "0.00-0.30",
    "command": "python3 calibrate.py degrade --formula adopted --runs 10 --out logs/degradation.adopted.json",
    "workdir": "/Users/wooyinq/.hermes/profiles/lanova/dev_team_workspace/REQ-20260921-002-deephealing-architecture-freeze/spikes/s5-latency-calibration",
    "exit": 0,
    "log_path": "/Users/wooyinq/.hermes/profiles/lanova/dev_team_workspace/REQ-20260921-002-deephealing-architecture-freeze/spikes/s5-latency-calibration/logs/latency.distribution.json",
    "degradation_log_path": "/Users/wooyinq/.hermes/profiles/lanova/dev_team_workspace/REQ-20260921-002-deephealing-architecture-freeze/spikes/s5-latency-calibration/logs/degradation.adopted.json",
    "gap_note": "分布取自同一 API 通道的 24 次真实调用（round 3）；本能力的真实调用条件与分布测量**同条件**（同并发/同网络/同冷热）；远端不可用时不得用未标定的数"
  },
  "rule_layer_adoption": {
    "allowed": true,
    "provider_classes_allowed": ["deterministic_rule", "cassette_replay"],
    "consistency_check": { "required": true, "runs": 3 }
  },
  "calibration": {
    "sample_count": 24,
    "p50_ms": 7443.408,
    "p90_ms": 42110.951,
    "p95_ms": 43358.907,
    "p99_ms": 54031.089,
    "max_ms": 54031.089,
    "derivation_rule": "声明值 = ceil_to(100, p95) + offset_ms(embed.text=250)；latency_ms_budget = ceil_to(50, p90) + offset_ms",
    "derivation_rule_sha256": "7590eab4b765671860eaa50b68de807606581bfdd439cb3aa6fe2d953edb0feb",
    "candidate_strict_ms": 43650,
    "candidate_loose_ms": 55750,
    "accepted_degradation_range": "0.00-0.30",
    "command": "python3 calibrate.py degrade --formula adopted --runs 10 --out logs/degradation.adopted.json",
    "workdir": "/Users/wooyinq/.hermes/profiles/lanova/dev_team_workspace/REQ-20260921-002-deephealing-architecture-freeze/spikes/s5-latency-calibration",
    "exit": 0,
    "log_path": "/Users/wooyinq/.hermes/profiles/lanova/dev_team_workspace/REQ-20260921-002-deephealing-architecture-freeze/spikes/s5-latency-calibration/logs/latency.distribution.json",
    "degradation_log_path": "/Users/wooyinq/.hermes/profiles/lanova/dev_team_workspace/REQ-20260921-002-deephealing-architecture-freeze/spikes/s5-latency-calibration/logs/degradation.adopted.json",
    "gap_note": "分布取自同一 API 通道的 24 次真实调用（round 3）；本能力的真实调用条件与分布测量**同条件**（同并发/同网络/同冷热）；远端不可用时不得用未标定的数"
  },
  "rule_layer_adoption": {
    "allowed": true,
    "provider_classes_allowed": ["deterministic_rule", "cassette_replay"],
    "consistency_check": { "required": true, "runs": 3 }
  },
  "fallback": {
    "on_timeout": { "provider": "deterministic_rule", "impl": "module:deephealing_kernel.providers.deterministic_rule:embed_text_rule" },
    "on_error": { "provider": "deterministic_rule", "impl": "module:deephealing_kernel.providers.deterministic_rule:embed_text_rule" },
    "on_invalid_schema": { "provider": "deterministic_rule", "impl": "module:deephealing_kernel.providers.deterministic_rule:embed_text_rule" },
    "on_budget_exhausted": { "provider": "deterministic_rule", "impl": "module:deephealing_kernel.providers.deterministic_rule:embed_text_rule" },
    "on_cassette_miss": "deterministic_stub"
  },
  "determinism": {
    "mode": "replayable",
    "cassette_key_fields": ["capability_id", "capability_version", "canonical_input_hash", "provider"],
    "seed_policy": "no_randomness"
  },
  "safety": {
    "secrets_in_context": false,
    "redact_fields": ["headers.Authorization", "env.*_API_KEY"],
    "max_output_bytes": 262144,
    "schema_strict": true,
    "prompt_injection_guard": "none"
  },
  "budget": { "per_tick_calls": 1, "per_npc_daily_tokens": 20000 },
  "tags": ["memory", "embedding", "v0"]
}
